,id,foodname,foodtype,recommend,imgurl,price
868,869,米汤胡萝卜泥6m+宝宝辅食,孕婴,"欢迎你们关注我的公众号——花姐小食光，我做过的132道辅食都收录在里面哦！
今天继续和你们分享比较清淡的辅食——米汤胡萝卜泥！含铁量丰富的小米，搭配爽口的胡萝卜泥，既好喝又营养。做法来说，也非常的简单好操作，麻麻们可以让爸爸们也尝试做一下，绝对的新手必备！",http://img.xiaochushuo.com/web/259583025.jpg!s4,37.11
869,870,超可爱的笑脸土豆饼,孕婴,香酥软糯的土豆饼，有了可爱的表情，让人忍不住会连吃好几个。可爱的笑脸，吃的时候也会心情好很多呢！！！,http://img.xiaochushuo.com/web/263314080.jpg!s4,83.67
870,871,生炒鸡,孕婴,"生炒是鸡肉最家常的做法之一，炒出来的鸡块
卖相诱人，用来下饭最好不过，肉质软嫩、营养丰富！",http://img.xiaochushuo.com/web/265088987.jpg!s4,86.68
871,872,鸡蓉豆腐丸子,孕婴,"鸡肉辅食做的不好，容易柴，有些妈妈头疼做不好，导致宝宝不爱吃。今天分享个10分钟鸡肉丸子给你们，新手妈妈、没时间妈妈都可以轻松应对。

加了些豆腐，使丸子肉质鲜嫩不柴,细腻滑嫩多汁。鸡肉虽然没有红肉（猪瘦肉、牛肉、羊肉）补血补铁的效果，但鸡肉相对红肉更好消化，还含有丰富的优质蛋白质、B族维生素。

参考月龄：9M+",http://img.xiaochushuo.com/web/260336557.jpg!s4,109.93
872,873,萝卜糕12m+,孕婴,"
欢迎你们关注我的公众号——花姐小食光，我做过的150道辅食都收录在里面哦！
今天来个南方口味的萝卜糕。广式萝卜糕是用腊肠做的，腊肠呢不太适合宝宝吃，所以我就改成了猪肉末。做得不正宗，欢迎南方妈妈来“找茬儿”！白萝卜开胃通便又助消化，宝宝不爱吃饭的时候，可以吃点。这道萝卜糕里还加入了猪肉虾米，营养更均衡哦！",http://img.xiaochushuo.com/web/260007374.jpg!s4,64.75
873,874,黄金米糕,孕婴,"想不想一次性将宝宝的饭、菜、手指食物全解决了？而且还营养够均衡。柚妈，可能吗？恩恩，看这个可以拿着吃的米糕，怎么样？
含杂粮米饭、豆制品、蛋类、菌藻类、根茎类蔬菜。从蔬菜颜色上来看，有橙红色、黑色、白色、绿色。食物种类越多，颜色越丰富，也就代表着营养越均衡丫。

食谱亮点
全是优点的米糕只需操作10分钟，全职妈妈必备法宝。

参考月龄：10M+",http://img.xiaochushuo.com/web/259111055.jpg!s4,68.51
874,875,孜然鸡胸肉,孕婴,少油低脂高蛋白，味道超赞。,http://img.xiaochushuo.com/web/264805707.jpg!s4,91.79
875,876,冬瓜肉丸汤,孕婴,清淡可口，简单省事，营养均衡。,http://img.xiaochushuo.com/web/264297148.jpg!s4,37.22
876,877,自制宝宝香肠,孕婴,一般来说，6个月以上的宝宝就可以开始吃肉了。鸡肉中的蛋白质属优质蛋白质，含有多种人体必需的氨基酸成分，非常容易消化和吸收。鸡肉性微温，各种体质的宝宝都可以吃。它补气益血，对身体较弱、食欲不好的宝宝更为适宜。,http://img.xiaochushuo.com/web/257651731.jpg!s4,95.22
877,878,宝宝辅食：好吃又健康的水果片,孕婴,"好吃又健康的水果片
什么都不加
成品酥脆、香甜
一口咬下去天然的水果焦糖味
烤两小时
消灭只需一分钟
苹果片切得薄点成品口感偏酥
切得厚点的吃起来肉头
ps:手工只需切片，主要时间是低温烘烤，大家只要设定好烤箱时间，就可以爱干嘛干嘛了哈。",http://img.xiaochushuo.com/web/235771695.jpg!s4,79.42
878,879,瑞典风味香蕉榛子酱薄饼-带着宝宝吃遍全球......,孕婴,"当宝宝还小，不能到处去看看的时候，
我会给他/她做各个国家的美食，
吃的时候和他/她讲每个食物的背后故事，
分享各个国家的风土人情。
然后等他/她长大了，就一起去环游世界，吃遍全球。

虽然还没有宝宝，但这是小芽一直以来想给未来宝宝做的事情",http://img.xiaochushuo.com/web/225117353.jpg!s4,85.66
879,880,虾仁炒豌豆,孕婴,"这个一个简单炒炒炒加一个“黄瓜碗”的造型，看着很清爽，吃着也很清爽，把春天吃进肚子里。这种造型谁都能做得来，不需要技巧无难度，需要一点时间，可以让孩子参与进来一起完（dao）成（luan）。

菜谱亮点
吸引眼球；提高宝宝食欲；拍照美腻；全家适合。

参考月龄：15M+",http://img.xiaochushuo.com/web/260019953.jpg!s4,80.63
880,881,葱油飞饼香肠卷,孕婴, get一个飞饼新吃法，卷一卷、烤一烤，形状可爱的像蚕宝宝躲在被窝里的，葱油飞饼香肠卷就做好了！上桌秒没了！ ,http://img.xiaochushuo.com/web/263507740.jpg!s4,92.49
881,882,快手早餐～菠菜鸡蛋饼,孕婴,宝宝最近有点便秘，就买了菠菜，菠菜可以顺肠通便，还能补铁，做成了菠菜鸡蛋饼，美味又好吃，特意加了一勺虾皮粉，还能补钙呢～,http://img.xiaochushuo.com/web/256523457.jpg!s4,49.42
882,883,山药饼,孕婴,孩子不喜欢吃山药，今天煲汤剩了些山药，我给做成了山药饼，孩子特别爱吃,http://img.xiaochushuo.com/web/263091156.jpg!s4,84.42
883,884,鸡肉玉米芝士肠 宝宝营养辅食，芝士+蛋清,孕婴,"孩子总是执着于各种形式的“肠”，只要尝过孩子很容易爱上口味鲜美、还有点弹牙的火腿肠。市售火腿肠为了延长保质期必须得加入多种添加剂，网上盛传“1根火腿肠18种添加剂”。

我们追求的不只是食品的口味，更多的是营养的供应。如果说20分钟就可以做好几根火腿肠，孩子下次想吃的时候热一下就可以，你干不干？少了添加剂，吃着更放心，毕竟健康第一位。

参考月龄：15M+",http://img.xiaochushuo.com/web/256273252.jpg!s4,42.97
884,885,干贝枸杞鸡脚汤,孕婴,此款药膳汤益气补血，营养丰富，有补钙补血防癌降胆固醇养肝的功效；煮起来简单方便，是气血双补的日常保养方，尤其适合经期后的女性饮。,http://img.xiaochushuo.com/web/259921723.jpg!s4,55.67
885,886,宝宝辅食之肉末蒸冬瓜+冰糖水蜜桃,孕婴,"蒸的好吃不上火。这句广告词不要太经典呦。这道菜也可以用这句话来形容，蒸的好吃不上火。特别适合小孩子来吃。肉末也很嫩易消化。
桃子硬，而且水果属生冷，小孩子不宜多吃，但是煮软了以后就可以给娃吃一些了。",http://img.xiaochushuo.com/web/255219862.jpg!s4,43.08
886,887,土豆泥芝士饼,孕婴,"土豆含有丰富的膳食纤维能促进宝宝胃肠蠕动促进消化预防便秘
芝士含有大量的钙、磷、镁等重要矿物质 帮助宝宝成长发育 当土豆泥遇上芝士不管是味道还是营养都堪称完美哟
关于番茄酱
不知道有多少妈妈和我一样喜欢自己熬一锅属于自己的番茄酱 口感绵密 酸甜可口欲罢不能",http://img.xiaochushuo.com/web/255188645.jpg!s4,113.51
887,888,#宝宝辅食#鳕鱼胡萝卜香菇粥,孕婴,"xa0 xa0适龄12M+
 营养美味的一款宝宝辅食粥，大家都知道鳕鱼肉味甘美、营养丰富，肉中蛋白质含量颇高。含丰富的DHA、DPA外，还含有人体所必需的维生素A、D，E和其他多种维生素。xa0 xa0xa0 xa0
xa0 xa0尤其是xa0鳕鱼肉质特别嫩，鱼刺也少，宝宝食用起来更安全。",http://img.xiaochushuo.com/web/260219087.jpg!s4,116.67
888,889,洋葱圈煎蛋饼-可以和宝贝抢着吃的美食,孕婴,"洋葱圈洋葱圈，最近看到圆圆的食材就很兴奋哈！
蛋香浓郁，混合彩蔬和小火腿丁，煎后的洋葱圈清甜不呛，很适合挑食不喜欢吃菜的小朋友......
如果大人吃，煎的时候还可以撒点黑胡椒，其实不撒也已很美味，是一款可以和宝贝抢着吃的美食",http://img.xiaochushuo.com/web/224512149.jpg!s4,49.47
889,890,24m+松仁玉米,孕婴,"欢迎你们关注我的公众号——花姐小食光，我做过的200道辅食都收录在里面哦！
今天我要分享一道松仁玉米。从营养上来说，松仁中含有大量的矿物质如钙、铁、钾等，能够给宝宝提供丰富的营养，配上玉米香甜可口，宝宝和你绝对吃了还想吃哦~",http://img.xiaochushuo.com/web/260703084.jpg!s4,44.39
890,891,蔬菜虾仁粥（2-3人份）,孕婴,寒潮来临，喝一碗暖乎乎清甜爽口的粥，慰藉当下的生活。,http://img.xiaochushuo.com/web/264131411.jpg!s4,118.93
891,892,宝宝辅食—双色蔬菜鸡蛋糕,孕婴,这么美丽的鸡蛋糕，宝宝随手抓起一个就吃掉啦,http://img.xiaochushuo.com/web/259109998.jpg!s4,91.94
892,893,南瓜鸡蛋羹,孕婴,"秋冬季节，孩子老人易感冒，增强免疫力健脾胃，南瓜蛋羹最适宜！厨娘加入了淡奶油和芝士干酪粉，让整个菜中西结合洋气满满哦！

南瓜泥和牛奶混合，再和鸡蛋搅拌均匀，南瓜最显著的营养作用就是健脾胃、增强免疫力，对于高强度运动后的恢复期，这是相当不错的营养食物。这样做好的蛋羹，带有清爽的甜味和蛋香，很是好吃。",http://img.xiaochushuo.com/web/264090922.jpg!s4,118.49
893,894,宝宝辅食之手指饼干,孕婴,"随着宝宝月龄的增加，他们尝试的辅食总类也越来越多，小零食总能让宝宝们欲罢不能。
自制的小零食，不但能补充营养，还能做到无添加剂，宝宝吃了更健康。

手指饼干作为手指食物，可是宝宝的最爱。平常带宝宝出去玩时，来上几根，不仅能让宝宝乖乖的不闹腾，关键它能在不知不觉中锻炼宝宝的手部精细动作及口眼协调能力。",http://img.xiaochushuo.com/web/258759031.jpg!s4,95.54
894,895,地瓜小米粥,孕婴,"为宝宝准备的辅食，自己也是从小老家地里有种，每次都会跟白粥一起煮，或者是煮饭，有时候也会弄成甜品，地瓜的作用也是很大的补脾益气，宽肠通便
而小米则是健脾和胃，除热解毒。",http://img.xiaochushuo.com/web/256334184.jpg!s4,55.39
895,896,宝宝辅食：西兰花鸡肉烘蛋,孕婴,"鸡肉富含高蛋白和氨基酸
西兰花含丰富维生素和矿物质
加入鸡蛋、牛奶

口感清爽，鲜嫩多汁，而且营养丰富
小芽用烤箱，也可以用平底锅小火烘煎或蒸锅蒸熟哈

适合宝宝年龄：18个月以上，确保把鸡肉煮烂一点哈。
难度：易
时间：25分钟
用具：刀、砧板、汤锅、烤箱/平底锅",http://img.xiaochushuo.com/web/235925933.jpg!s4,79.98
896,897,8m+自制鱼肉松（宝宝辅食）,孕婴,"欢迎大家关注我的公众号“花姐小食光”，获取更多营养美味的辅食做法！
今天大厨花姐想和大家分享的，是自制鱼肉松～之前也做过一期猪肉松（点击蓝字查看），很多花粉表示很喜欢，但是都有一个疑问，能不能换成别的肉去做。在这里说明一下哈，猪肉松的做法换成牛肉和鸡肉都是可以的！那今天的这个鱼肉松，做法肯定和那个不一样了，详细看文中哈！我做的时候选择的是三文鱼，深海鱼相对来说脂肪比较低，富含不饱和脂肪酸，能促进宝宝大脑和身体发育，而且颜色鲜艳很容易引起宝宝食欲。你们动手做做就知道了哈！",http://img.xiaochushuo.com/web/258218477.jpg!s4,47.02
897,898,蘑菇小炒,孕婴,来个家常小炒肉，做法简单 ，营养美味,http://img.xiaochushuo.com/web/262907223.jpg!s4,93.88
898,899,芋头排骨汤,孕婴,"补肾养血、滋阴润燥的芋头排骨汤，是老幼皆宜的滋补品，也是秋日养生素食一宝。 芋头口感细腻柔软，绵甜香糯，具有益胃，宽肠，通便散结，不益肝肾，填精益髓等功效。 用它煲汤，是秋冬季节一款很滋补的养生汤。

芋头性甘辛、有小毒、性平，归肠、胃经。具有益胃、消肿止痛、宽肠、解毒、补中益肝肾、散结、调节中气、化痰、通便、益胃健脾、添精益髓等功效。排骨味甘咸、性平，入脾、胃、肾经，补肾养血，滋阴润燥，主治热病伤津、消渴羸瘦、肾虚体弱、产后血虚、燥咳、便秘、补虚、滋阴、润燥、滋肝阴，润肌肤，利二便和止消渴。",http://img.xiaochushuo.com/web/263919691.jpg!s4,93.18
899,900,鲜虾豆腐蒸水蛋,孕婴,蒸水蛋 也称鸡蛋糕 一款老少皆宜的快手菜 健康营养 很家常的一道菜 更适合辅食阶段的宝宝们 想要蒸出水嫩嫩的鸡蛋也是不容易的 掌握好水量 水温 打蛋技巧和火候是成功的关键哦,http://img.xiaochushuo.com/web/254415446.jpg!s4,65.85
900,901,宝宝辅食 超萌甜甜圈,孕婴,我家宝宝最爱这个甜甜圈了能吃好几个，我一次做好几份材料的量，多的会送给小宝宝们，自己做的放心又安全，主要没有什么添加剂，用小红锅做也简单快手，快过年了，给宝宝们做些超级可爱的甜甜圈吧。,http://img.xiaochushuo.com/web/259313309.jpg!s4,79.13
901,902,紫薯燕麦饼,孕婴,今天我们来做一款无油无糖的饼干，简单快手，成功率很高，轻松拯救手残党。不用打发黄油、不用造型！食材蒸熟碾碎后，放在一起拌一拌，搓成球状压一压，最后一烤就出锅了。,http://img.xiaochushuo.com/web/263902566.jpg!s4,87.26
902,903,宝宝手指泡芙,孕婴,"我们吃过的泡芙外皮松软大都里面加着奶油，孩子的泡芙跟我们吃过的除了都是空心，口感完全不一样。整体是酥脆的，咬下去是咔嚓咔嚓声，孩子很喜欢这样的小零食。
不需要打发，也不需要什么技巧，零基础的妈妈们赶紧来试试。

食谱亮点
特别好操作，不费时。

YOMA小叮咛
没有加糖，不鼓励加糖，有很多妈妈告诉我孩子的辅食没有甜味不吃。从刚开始加辅食就得注意了，不吃水果味米粉；做馒头发糕尽量不放糖少放糖，饼干蛋糕能少放糖一定不要多放糖。爱上甜味，你后面的辅食会很难做。

参考月龄：8M+",http://img.xiaochushuo.com/web/258563569.jpg!s4,33.83
903,904,8个月以上辅食蛋黄溶豆,孕婴,"好多人买了烤箱必学的一个就是溶豆，个人觉得蛋黄溶豆的难度比蛋白溶豆低很多，今天就教大家做蛋黄溶豆吧。奶粉的话如果给一岁以内的孩子吃需要选择婴儿奶粉。我用的成人奶粉照样能做，不存在消泡问题，只要蛋黄打发到位就能成功。
溶豆小小一颗，可以锻炼孩子的精细动作，提高手眼协调能力，促进大脑发育。但是溶豆算是零食不可以多吃哦。有时候带孩子出门哭闹拿出来暂时哄哄她也是可以的。自己做的无添加安全又放心。",http://img.xiaochushuo.com/web/260688484.jpg!s4,53.90
904,905,简单快手小零食～黑芝麻椰香吐司条,孕婴,黑芝麻有护肤美肤的功效与作用，黑芝麻可以使皮肤保持柔嫩、细致和光滑。 椰蓉和营养的芝麻结合，完美的小零食，与下午茶搭配的甜点。,http://img.xiaochushuo.com/web/262831904.jpg!s4,32.64
905,906,超好吃的蛋烤吐司块,孕婴,最近迷上了土司，变着花样吃果真超级赞。今天再来一个蛋烤吐司，一口一个超方便！,http://img.xiaochushuo.com/web/263037675.jpg!s4,38.06
906,907,家宴菜谱～年年有鱼之皮蛋豆腐,孕婴,"这是一道
简单易做的凉拌菜
口感咸鲜松软
补钙降压
营养又美味哦",http://img.xiaochushuo.com/web/259275126.jpg!s4,82.81
907,908,番茄面片12m+：酸甜开胃又营养！,孕婴,最近天气太冷了，让我总忍不住做些带有汤水的食物，不仅温暖身体同时还能有效滋补，so今天呢，做了一碗番茄面片，番茄富含很多营养成分，但过早给宝宝喝压榨的生番茄汁，是对身体没有好处的，建议宝妈们一定要把番茄煮熟呦！,http://img.xiaochushuo.com/web/262652169.jpg!s4,91.82
908,909,宝宝辅食：香甜软糯，暖融融的南瓜时蔬炖饭！18M+,孕婴,"香甜软糯
暖融融的南瓜时蔬炖饭

对于小宝宝来说
南瓜本身味道就是甜甜糯糯的
直接加点水煮、蒸或做成南瓜汤、南瓜饼就会很好吃
做成南瓜酱汁更是无人能敌
小宝宝一般都爱吃哦

小芽搭配用了时蔬
大家还可以加点鸡肉、猪肉进去哈",http://img.xiaochushuo.com/web/236328400.jpg!s4,49.25
909,910,西兰花芝士饭团,孕婴,"色彩斑斓的小饭团外形亮眼可爱！诱人极了！
西兰花富含维生素C、蛋白质、钙、磷、铁、钾、锌等，营养素非常高的蔬菜，此饭团膳食纤维丰富，有利于排出毒素，预防便秘、健胃消食、增强记忆力、提高免疫力的作用。老少皆宜的一款饭团哟！",http://img.xiaochushuo.com/web/263656460.jpg!s4,41.46
910,911,宝宝辅食：虾仁时蔬小馄饨-13M+,孕婴,"【虾仁时蔬小馄饨】
平时想不出要吃什么的时候
就会包馄饨

最喜欢的就是虾仁馅的
超级鲜美
又嫩又滑又香
热乎乎吃掉一碗超级暖心
虾仁建议用鲜活蹦跶的鲜虾
口感更Q弹营养也更好

因为给小宝宝吃
所以虾仁较多
芹菜加了一点提味
包法是很简单的
大家一看就会哈
",http://img.xiaochushuo.com/web/243020157.jpg!s4,70.73
911,912,橙汁磨牙饼干,孕婴,"麻麻们对磨牙棒都不陌生，即使没做过，肯定也买过。自己做呢原料比较新鲜，妈妈们比较放心。用于长牙的时候磨磨牙，锻炼宝宝的咀嚼能力,刺激乳牙萌出。一天也就1、2根，做一次可以吃7天、10天。
无糖无油，比较硬，不用担心一咬会掉下来一大块，宝宝放嘴里，一边磨口水一边掉，用口水慢慢磨化了，小柚子8、9个月的时候特别喜欢嚼，嚼一根需要20多分钟。大宝宝也可以当零食吃。

参考月龄：7M+",http://img.xiaochushuo.com/web/257787307.jpg!s4,77.57
912,913,玉米脆片,孕婴,"怎么给宝宝吃粗粮比较好呢？不仅要宝宝愿意吃粗粮，还要宝宝易吸收，这可难倒妈妈们了，其实不难的，学会今天这招，保证让宝宝爱上吃粗粮！
市场上的玉米片，大多数是油炸的，对于油炸食物，我们妈妈就会绕道而行了。今天我教大家自制非油炸的健康玉米片，不仅健康，脆脆的还好吃呢！选用简单的食材，快手易做不说，还可以密封保存时间长；带娃出去，还便于携带。

平时的话，既可以直接当零食食用，还可以泡在牛奶或者酸奶中当早餐或者加餐给宝宝食用。
",http://img.xiaochushuo.com/web/262558731.jpg!s4,105.94
913,914,宝宝无盐黄油饼干,孕婴,这款小饼干很适合宝妈学做。过程简单，做出的饼干酥软香甜，造型美观。,http://img.xiaochushuo.com/web/257017208.jpg!s4,31.91
914,915,12m+米饭香肠,孕婴,"欢迎你们关注我的公众号——花姐小食光，我做过的200道辅食都收录在里面哦！
今天分享的这道米饭香肠，我做的时候除了米饭和猪肉，还放了一些芹菜叶和洋葱，这两种东西单独吃我儿子都是不吃的。做成香肠之后，自己拿着就吃了。你们也可以把芹菜和洋葱，换成你家孩子不喜欢吃的菜放进去哦~",http://img.xiaochushuo.com/web/260600215.jpg!s4,117.14
915,916,宝宝健康食谱  猫爪饼干,孕婴,猫爪饼干三种口味，有原味，抹茶味和可可味，香酥可口，童趣十足，宝宝大爱~,http://img.xiaochushuo.com/web/262298848.jpg!s4,113.72
916,917,腐乳菜花,孕婴,夏季必备下饭神器，做菜时放入几块腐乳或腐乳汁，会让你的素菜更入味，颜色诱人非常有食欲！,http://img.xiaochushuo.com/web/263573392.jpg!s4,65.01
917,918,红枣山药糕,孕婴,"棉棉的山药加上香甜的红枣，
口感很赞，几乎所有宝宝都爱吃~
山药含有丰富的蛋白质、碳水化合物、钙、磷、铁、胡萝卜素
等多种营养成分还含有淀粉酶、
多酚氧化酶等物质，
有利于宝宝脾胃消化和吸收。

红枣被称为“天然维生素丸”，
自古就是养生佳品。

制作简单
营养丰富
口感香甜
是一道非常理想的宝宝辅食",http://img.xiaochushuo.com/web/255223827.jpg!s4,119.27
918,919,姬松茸板栗炖鸡汤,孕婴,最近几天烟台的气候忽冷忽热的，天气也干燥的要命，这个时候适当为家人煲一点汤补充水分是必不可少的，今天用姬松茸和茶树菇，加了板栗，营养翻倍，姬松茸含有多种活性多糖，其组份比灵芝高出5倍，目前已知在姬松茸的菌丝体中发现约10多种多糖。用动物实验比较各种多糖的作用，表明其中不少多糖均有抗瘤的作用。,http://img.xiaochushuo.com/web/263010834.jpg!s4,81.54
919,920,菠菜蛋卷,孕婴,紫薯含有丰富的膳食纤维、淀粉、维生素、微量元素（硒、铁、钙、钾 等）及花青苷、糖蛋白、胡萝卜 素、去氢表雄（甾）酮等多种功能性因子，具有抗氧化、抗肿瘤、增强记忆、预防高血压、修补心肌、减轻肝机 能障碍、增强机体免疫力等功能。,http://img.xiaochushuo.com/web/264356713.jpg!s4,32.98
920,921,快手小馄饨,孕婴,不但味道鲜美，而且营养还能给宝宝补充钙哦。,http://img.xiaochushuo.com/web/248910714.jpg!s4,64.64
921,922,香蕉蛋饼,孕婴,香甜松软的早餐饼，做法简单，不放水不放油，快手又营养,http://img.xiaochushuo.com/web/263363502.jpg!s4,69.62
922,923,宝宝辅食：宝宝版咪咪虾条—想不想试试妈妈小时候的零食呢！24M+,孕婴,"哈哈哈
小时候只要拿到零花钱
就是咪咪虾条、小麻花加萨琪玛
橙色的外包装
一只弹吉他的喵咪
脆脆香香，回味无穷
现在偶尔在超市看到，还会多瞄几眼

80后集体回忆
因为做了点虾皮粉
感觉一定要复刻下这款复古，并流行至今的小零食

",http://img.xiaochushuo.com/web/233726796.jpg!s4,60.86
923,924,红烧牛肉空心面,孕婴,东北人特别喜欢吃面食，周末逛超市看到这款空芯面在做新品发布会，于是去了解了一下，同时也品尝了，果不其然，面非常筋道，具有“筋、韧、滑、嫩”的特点，赶紧买了几包回来，宝贝要求要吃牛肉面，到家刻不容缓做起来，面条补气虚、牛肉甘温、安中益气、养脾胃。,http://img.xiaochushuo.com/web/263140588.jpg!s4,82.61
924,925,12m+鳕鱼软饭（宝宝辅食）,孕婴,今天教大家一道电饭煲就可以搞定的食材丰富的鳕鱼软饭。（每次做鱼，大家总会问换成别的鱼行不行，再情调一下，可以换成刺比较少、新鲜的鱼，鳜鱼、三文鱼...）适当的吃点鱼类，可以给宝宝补充DHA，促进大脑神经发育。再加上，今天我做的时候放了各种蔬菜，米饭和菜一起焖的非常软烂。吃起来的口感是很软有一点绵的口感，小宝宝都会很喜欢。认真的安利，一岁以上的宝宝可以适当放点盐或者酱油进行调味哈~,http://img.xiaochushuo.com/web/258441482.jpg!s4,76.81
925,926,宝宝辅食12M➕ 秋葵牛奶蒸蛋羹,孕婴,加了牛奶味道不一样哦 很香！我儿子分分钟光盘的那种,http://img.xiaochushuo.com/web/261030167.jpg!s4,74.83
926,927,无油轻食（,减肥,这份午餐里面包括蔬菜，水果，鸡蛋，虾，鸡肉。可以说是非常全面营养了，鸡肉是减肥的最佳食物，热量低，脂肪低。这一大份我都没吃完，饱腹感很强。以下材料是两人份的量,http://img.xiaochushuo.com/web/252301688.jpg!s4,110.32
927,928,版土豆泥,减肥,"减肥就告别沙拉酱吧…
这是一道健康的土豆泥
土豆是主食
土豆是主食
土豆是主食",http://img.xiaochushuo.com/web/253753188.jpg!s4,69.92
928,929,西兰花这样做健康又美味，,减肥,"★★★★★
小圆食记
Menu
杏鲍菇营养丰富，富含蛋白质、碳水化合物、维生素及钙、镁、铜、锌等矿物质，具有降血脂、降胆固醇、促进胃肠消化、增强机体免疫能力、防止心血管病等功效。
兰花可能最显著的就是具有防癌抗癌的功效，菜花含维生素C含量极高，比大白菜、番茄、芹菜都高，不但有利于人的生长发育，更重要的是能提高人体免疫功能。
★★★★★
创意指数
杏鲍菇扒西兰花",http://img.xiaochushuo.com/web/245813277.jpg!s4,63.58
929,930,夏日,减肥,每次减肥中午必吃的凉拌菜，主食就搭配一个煮玉米，或者一个小的烤山芋。因为每个人吃的量不同，所以调料都根据自己的口味来调整。我每次都大概做两到三天的量。,http://img.xiaochushuo.com/web/248264954.jpg!s4,57.53
930,931,好吃到放弃,减肥,南方人爱吃粉，我们家也不例外。米粉几乎每周至少吃一次，今天做了一道番茄鸡蛋米粉当早餐，分分钟光盘的节奏！连一滴汤都没得浪费！简单快手又美味～,http://img.xiaochushuo.com/web/263372438.jpg!s4,72.22
931,932,十味 三明治,减肥,中午不想吃米饭，吃个三明治是再好不过了，沿着中线将三明治切开，整齐的放在便当盒子里，十分好看；搭配一些西兰花、圣女果；就是一个颜值很高的简易午餐呢。,http://img.xiaochushuo.com/web/262256389.jpg!s4,78.69
932,933,瘦身餐也可以这么好吃-凉拌鸡丝,减肥,减肥餐不再是煎熬，破除旧式，凉拌一样可以好吃到尖叫。,http://img.xiaochushuo.com/web/262562034.jpg!s4,57.20
