,id,foodname,foodtype,recommend,imgurl,price
461,462,夏日开胃小菜——柠檬橙香萝卜,西餐,"腌制后的萝卜，
爽口清脆，
木有萝卜味，
微酸清甜，
还伴有柠檬和橙香，
小伙伴们也快动手试试吧！",http://img.xiaochushuo.com/web/254164974.jpg!s4,98.98
462,463,玄妙感觉的孜然羊肉披萨,西餐,"周末外出时遇到了虎爹的朋友，人家非要将手上拿的羊肉分我们一半，而且是大半。当时感觉就是，太幸福了！
 
一条大羊腿，带回家后煮了锅浓浓的羊肉汤。在给剩下的羊肉打包时，就想起了曾在一家西餐厅吃到的“孜然羊
肉披萨”，好吃的让人惦记。其中孜然的香味既给羊肉去了膻还能引发人的食欲，再跟香浓奶酪搭配，有点玄妙
的感觉。
 
厨师将意大利披萨跟新疆的孜然羊肉做了创意组合，美好的味道跟玄妙的感觉留存心底后觉得美食是自由的，可
以天马行空的跳跃搭配，只要味道能深入人心就是完美作品。
 ",http://img.xiaochushuo.com/web/234298379.jpg!s4,64.58
463,464,自制意大利面条,西餐,意大利面和牛排应该是我们比较容易接受的西餐之一了，不过像我们三线小城市，买意大利面条得去大一点的超市才能买到，总是没有那么方便。,http://img.xiaochushuo.com/web/260520551.jpg!s4,36.07
464,465,意式海螺沙拉,西餐,最近肉吃多了开始觉得发腻，又想吃海鲜换口味了。意大利作为地中海料理的发源地兼西餐鼻祖总会有一些特色的东西吸引我们，而那边做海鲜也很擅长，所以我这次就借鉴那边的做法做个海鲜沙拉，主料用海螺。,http://img.xiaochushuo.com/web/226643670.jpg!s4,54.99
465,466,鲜椒手撕杏鲍菇—#GOURMETmaxx西式厨师机#,西餐,"一直都知道Gm做西餐很棒，但是也非常想试一下用#GOURMETmaxx#来炒中式家常菜肴，所以首先选择了三道素菜，为了最大化使用西餐厨师机，这道手撕杏鲍菇采用了先蒸后炒的方法，一机就可以完成，营养成分不会流失，爆炒一下也更美味。
用具：GOURMETmaxx西式厨师机
使用功能: 蒸、翻炒",http://img.xiaochushuo.com/web/260643315.jpg!s4,90.57
466,467,金枪鱼意面,西餐,平时工作之余喜欢厨艺，一位五星级酒店厨师长朋友教我做的，味道真的是棒棒滴。,http://img.xiaochushuo.com/web/261350922.jpg!s4,84.32
467,468,黑椒鸡扒意粉,西餐,厨师的第一次西餐，提前一天从网上买来餐具，准备食材。鸡扒很鲜嫩，配上西瓜汁，真是一番享受,http://img.xiaochushuo.com/web/251803118.jpg!s4,32.00
468,469,罗马风味意面,西餐,"意大利是西餐鼻祖，也是地中海饮食的发祥地。在罗马时代意大利的饮食已经席卷了整个欧洲，即使是现在欧洲的饮食文化也还是沿袭着古罗马时期的风格，不同的是现代社会下料理的种类可以任意的增加和改变。家里前段时间买了块蓝纹奶酪，听说这东西很臭，中国人吃不惯。但我觉得应该跟咱们国家的臭豆腐也没什么区别，吃得了臭豆腐应该也能吃得了‘臭’名昭著的蓝纹。

打开之后闻了闻并没有臭豆腐那么臭，只有股淡淡的味道，舔了舔有点微微的酸，完全在可接受范围之内。很久前我就想尝试这蓝纹奶酪，打算拿它来做意面",http://img.xiaochushuo.com/web/262705399.jpg!s4,82.37
469,470,南瓜香肠意面,西餐,前几天陪我家闺女看动画片，看小猪佩奇吃意大利面，她说她也想吃，我就满足她去一家西餐店，拿到菜单咋舌了，价格都在40块以上，给孩子点一份偏清淡的意面，孩子居然不爱吃说气味太重了，我吃着也觉得，肉酱料有点重！这个周末空闲下来，准备做一份适合儿童吃的意面，买了儿童香肠搭配，还加了一个神奇的食材，你们猜猜是啥？那神奇食材就是南瓜哦，用南瓜制作酱料，拌意大利面的酱也是比较重要的，这个口感香甜，也有金黄诱人的颜色，加上儿童香肠加入特别适合儿童食用,http://img.xiaochushuo.com/web/260864584.jpg!s4,104.08
470,471,十味 香肠菌菇披萨,西餐,自己做了几次披萨之后真的喜欢上了这种花样多变又营养比较匀衡的食物，其实我喜欢它主要的还是口味上可以千变万化。加上我本人的口味比较偏好西餐，所以当我懒得做大餐的时候就会整这些简单又好吃的东西来解馋。这一次我打算用香肠和蘑菇来做款披萨，因为近来才觉得蘑菇很好吃，以前我不太待见这些菇类，嘿嘿。家里面奶酪有好几种，索性就用两种奶酪一起做个披萨看看效果如何吧,http://img.xiaochushuo.com/web/262274819.jpg!s4,40.59
471,472,圣诞季：芦笋奶油浓汤,西餐,我对这道芦笋浓汤可谓是久仰大名很久了，相信很多人去西餐厅的时候会点上一道来喝，我个人虽然不喜欢蔬菜但味道比较浓郁口感厚重的浓汤还是蛮心仪的。以前自己也试着做过些其他的浓汤，这次试试芦笋的，话说这芦笋可真是要我好找，一些大超市里面竟然都没有，最终在一家农贸市场一进门就找到了。我还说这真是踏破铁鞋无觅处得来全不费工夫……,http://img.xiaochushuo.com/web/260754411.jpg!s4,34.64
472,473,美味+营养+核桃+肉酱意面,西餐,意大利面，又称为意面、意粉，它是西餐品种中最最接近中国人的饮食习惯，也是最容易被国人接受的一种面食。关于意大利面条的起源，有人说是源自古罗马，也有人的说是由马可·波罗从中国经由西西里岛传至整个欧洲的说法。 意大利面的原料：杜兰小麦是最硬质的小麦品种，具有高密度、高蛋白质、高筋度等特点，用它制成的意大利面通体呈黄色，耐煮、口感好。在超市里我们看到的意大利面有各种不同的形状，除了普通的直身粉外还有螺丝型的、弯管型的、蝴蝶型的、贝壳型的等等，真是从外观上就让人垂涎欲滴的哦。,http://img.xiaochushuo.com/web/260820447.jpg!s4,49.68
473,474,酸甜鱼丸牛肉菠菜拌面,西餐,今天给大家分享的是一道酸甜开胃的宝宝面！因为我家小笼包爱吃外面西餐厅的肉酱意面，我又怕调味料太多不健康就想到了今天这款新手妈妈都能做出的面，来减少宝宝在外吃不健康食物的机率！,http://img.xiaochushuo.com/web/262693229.jpg!s4,66.09
474,475,土豆泥沙拉,西餐,看深夜食堂，有些菜品不待见，有些还是很馋的，日本人很善于把西餐融合亚洲人口味变得更好吃。,http://img.xiaochushuo.com/web/20660541.jpg!s4,87.48
475,476,鸡肉主厨沙拉,西餐,"主厨沙拉，几乎每个西餐厅都会有，它是主厨们精选多种食材搭配一起的精心之作。
今天我来效仿一次。",http://img.xiaochushuo.com/web/224871545.jpg!s4,89.85
476,477,三文鱼薯饼,西餐,如何既有情调，也简单易做的在自家厨房里，能制作出西餐厅的简易西餐呢，就让我来告诉你怎么做吧，动动手，和你最爱的TA来一场说吃就吃的烛光晚餐吧！,http://img.xiaochushuo.com/web/223904640.jpg!s4,31.54
477,478,三文鱼青酱螺旋面,西餐,"网上买的新鲜罗勒做一次没有吃完，还剩下很多。我这人对数字和重量没什么概念，所以这次明显是买多了。为了不让它们烂掉我决定把大部分晒干之后保存起来，以后做西餐的时候随时取用也比较方便，最主要的是晒干了经放
   留下的一小部分我打算再做一道意面，还是青酱，这次来点高端的，配三文鱼。我跟老头子都爱吃三文鱼，尤其偏爱吃生的，这次老头子买了一块回来我用掉一些另一些切片直接吃。",http://img.xiaochushuo.com/web/226720800.jpg!s4,37.08
478,479,黑胡椒土豆饼,西餐,土豆泥+黑胡椒，配上香芹，有西餐的味道。,http://img.xiaochushuo.com/web/3784746.jpg!s4,56.52
479,480,自制午餐肉,西餐,自制营养健康美味的午餐肉，再也不买超市的午餐肉了，添加太多。在网上厨房搜的做法，有兴趣的朋友自己动手做一做吧。,http://img.xiaochushuo.com/web/1416942.jpg!s4,33.61
480,481,【迷迭香烤羊腿】中西混搭版,西餐,孜然、洋葱和蒜本来就是标配，相对中式调味而言多加了迷迭香。而西餐香料搭配的话，洋葱和蒜也是比较泛搭，搭迷迭香也常见。实际吃的感觉完全没有违和感，在我来讲还比单用迷迭香的要好吃多,http://img.xiaochushuo.com/web/227007558.jpg!s4,109.91
481,482,白兰地巧克力布朗尼,西餐,布朗尼蛋糕在咖啡馆和西餐厅可谓常见，衍生品也多种多样，既像饼干又像蛋糕，有乳脂软糖的甜腻，又有蛋糕的绵密松软；夹杂果仁，咬即碎，含即溶。为什么这丰富口感的高大上反而可作为入门级甜点？相传巧克力布朗尼原是一位胖胖的黑人老嬷嬷在做蛋糕时忘记打发了奶油，还混淆了高粉低粉，但结果这款失败品的湿润绵密竟成了意外的美味，这么一想，这可爱的错误只要备齐了材料，反而较之一般蛋糕更简易操作了，那就让我们现观现做，赶紧试试这款华丽丽又无难度的甜品吧。,http://img.xiaochushuo.com/web/18808060.jpg!s4,82.13
482,483,黑椒新西兰牛柳粒,西餐,在@美厨美食课堂有幸认识了苏浙汇的副主厨乔师傅，他教了我们一道很有特色的黑椒牛柳粒。今天我改变了牛肉的腌制方法，和摆盘。一道牛肉料理好吃不好吃，就是口感，如果一道牛肉料理咬都咬不动，那必定是一道失败的。你可以有2种选择一是放添加剂让肉质纤维断裂。第二就是选择肉质肥美的新西兰牛柳。当然我相信绝大多数人会选择第二种。接下来就让我一步一步教大家如何制作。,http://img.xiaochushuo.com/web/18813085.jpg!s4,111.72
483,484,黑椒汁,西餐,烧汁，黑胡椒，蒜碎洋葱碎，餐用红酒，牛清粉，黄汁粉，鸡粉，,http://img.xiaochushuo.com/web/null.jpg!s4,39.99
484,485,意大利肉酱意粉,西餐,这是一道非常非常惹人爱的美味。因为在西餐品种中意大利面是最接近我们国人哒饮食习惯的。可以配着餐包一起吃，味道你懂的。,http://img.xiaochushuo.com/web/11851272.jpg!s4,94.14
485,486,黑椒香草牛排 ,西餐,去超市买两块上好的牛排也不是很贵，至少比在外面吃要便宜很多。用黑胡椒碎、百里香、鼠尾草、迷迭香等混合成的香草料腌制提香味，大蒜、洋葱末去腥提鲜，柠檬汁去腥提味；在家也能打造出和西餐厅一样美味的黑椒香草牛排。咱也喝点红酒，看着电视，吃着牛排，感觉也不错呀,http://img.xiaochushuo.com/web/15926220.jpg!s4,73.73
486,487,酸奶奥利奥水果盆栽,西餐,"重点是加了“跳跳糖”
不腻又好次..跳跳糖在舌间跳跃.. 
自己做滴比较快手简单啦..
",http://img.xiaochushuo.com/web/19231473.jpg!s4,69.57
487,488,鲈鱼-秘制西式香料烤鱼,西餐,中国年·西餐味，同样一条鱼，用简单的食材融合西餐的制作，中西合璧的“年年有鱼”，非常独特的体验！,http://img.xiaochushuo.com/web/14660977.jpg!s4,91.60
488,489,意大利千层面,西餐,今天是七夕，也有人叫中国的情人节，虽然节日是中国的但我知道很多人还是会选择去西餐厅吃晚餐，因为感觉比较浪漫吧。其实西餐在家里也可以做，我把这款在国人中也很有人气的千层面的做法一步步分解，来应个景。喜欢的可以试试看哦,http://img.xiaochushuo.com/web/13706314.jpg!s4,37.76
489,490,烤鸡翅,西餐,话说我一直觉得烤鸡翅是一道很不容易做得难吃的烤味，自家怎么烤味道还都过得去，但比起一些靠谱的西餐馆里端上来就让人把持不住的烤鸡翅，还是有一些距离。我试过很多种烤鸡翅的方法，总想要做法简单、再简单一点，味道好吃、再好吃一点。说到底，烤翅需要外皮焦香、肉质丰厚且入味，怎么办到？来一起看看。,http://img.xiaochushuo.com/web/19166374.jpg!s4,64.39
490,491,培根鸡肉卷,西餐,"走进西餐厅经常会被舒缓的音乐，柔和的灯光，温馨的用餐环境所陶醉，尤其是食物的摆盘精雕细做就象是一道道艺术品。
 
所以去西餐厅享受美食的同时我也经常要偷师学几手，闲暇时在家里花点心思，做好的食物用心摆个造型就能让人眼前一亮，就象这道培根鸡肉卷一样，材料和制作方法都不难，轻轻松松就可以在家享受精致西餐了。",http://img.xiaochushuo.com/web/18910794.jpg!s4,66.00
491,492,老婆牛排,西餐,牛里脊，西餐中的菲力，家庭版的老婆牛排,http://img.xiaochushuo.com/web/263780256.jpg!s4,82.95
492,493,土豆鲜蚝浓汤,西餐,"在吃过头盘之后接下来就是汤，西餐中的汤有很多种，咱们国人比较熟悉的是各种奶油汤和蘑菇汤。今天做个法式浓汤，用鲜蚝，打开你的味蕾。汤的作用就是温润肠胃，给它们个信号起来准备干活，咱们国人也有说法叫吃饭前喝汤有利于瘦身，不管怎么说这汤都是好东西。尤其在天气很冷的时候你坐在桌边是不是最渴望的就是一碗热汤呢？相信一定是的，食客们，咱们上汤啦~~
 ",http://img.xiaochushuo.com/web/233664118.jpg!s4,97.98
493,494,来一只妖娆的烤鸡,西餐,"自从几年前搬回第一台烤箱开始，它已经成为我厨房里最不可或缺的成员。
不说甜点、面包之类，单是家庭普通中西餐都离不了它。
烤制食物的好处是，它有煎炸的酥脆，却没有煎炸的油腻。
最重要的是，一且准备妥当，交给它就好。
",http://img.xiaochushuo.com/web/227455181.jpg!s4,112.52
494,495,烤香肠蔬菜沙拉,西餐,"前些时日网购了一些烤肠回来，因为在便利店单买比较贵，想着反正家里也有烤箱，不如网购划算。不过那家店不零卖，是打包好的一次四包，想着自己爱吃也就下单了。到手之后我给分装成了小包装，一次四根的量正好够一顿吃的

不过这东西冻的久了我就开始想办法解决它们，之前做了西餐什么的，突然我就想到了沙拉。因为家里还有蔬菜需要解决，我就决定直接用它们来一个沙拉组合",http://img.xiaochushuo.com/web/263889359.jpg!s4,70.81
495,496,香煎杏鲍菇,西餐,简易西餐 美味可口 ,http://img.xiaochushuo.com/web/12476357.jpg!s4,108.45
496,497,橄榄油意面,西餐,据说，意大利料理是跟中国菜最相似的外国料理。一开始以为西餐很复杂，多做几次发现其实就是炒面。。。意面中总是用很多不同的酱，橄榄油意面算是比较清淡的意面。,http://img.xiaochushuo.com/web/795096.jpg!s4,113.56
497,498,凯撒沙拉,西餐,凯撒沙拉被称为“沙拉之王”，常年坐镇西餐厅，给人高大上却难亲近的印象。丘比告诉你，这道菜在家也能轻松做！只要一瓶凯撒沙拉口味的丘比沙拉汁，就能做出既不失王者风范又亲民的凯撒沙拉哦！,http://img.xiaochushuo.com/web/20660211.jpg!s4,51.02
498,499,香煎杏仁鳕鱼,西餐,"鳕鱼做为深海鱼中的一种，具有刺少和肉质鲜嫩的特点，营养丰富也特别容易消化吸收不仅对心血管有好处，对大脑发育智力和记忆力增长都有促进作用，尤其适合给老人和孩子食用。
 
习惯了中式的红烧和清蒸之后，用西餐的方法做了这道香煎杏仁鳕鱼，口感很大牌，白葡萄酒和黄油的浇汁让这道鳕鱼有着完全不同的口感，洋葱和杏仁的香味伴着细嫩的鱼肉一起吃，是口感和味觉的多重享受。",http://img.xiaochushuo.com/web/16240548.jpg!s4,75.08
499,500,水煮西兰花,西餐,在西餐厅经常点这道菜，今天特意学了下怎么做，其实不是特别难，个人感觉比餐厅美味！,http://img.xiaochushuo.com/web/2195205.jpg!s4,56.79
500,501,香煎三文鱼,西餐,护心补脑西餐大菜,http://img.xiaochushuo.com/web/7218213.jpg!s4,81.02
501,502,黑椒牛肉,西餐,"老头子办了个会员，前些日子搞活动，可以用积分加99块钱换购超值的牛排组合。很幸运他抢到了一份，其中有一半的牛排被我煎着做西餐吃掉了，还有一些我就想着换个花样。因为这种牛排比较薄，口感又很嫩，所以我觉得拿来炒着吃也是不错的

黑椒牛柳咱们都知道，是一道比较有名气的菜，饭店里点它的人也多。所以我就想用这牛排来做，因为它不是牛柳，所以叫黑椒牛肉，吼吼~",http://img.xiaochushuo.com/web/263826718.jpg!s4,91.27
502,503,黑椒培根土豆片,西餐,啦啦啦～做起来很快又好吃.菜鸟级别的做这道菜一般不会失手。吃起来有西餐味儿哈哈哈！很香！ ,http://img.xiaochushuo.com/web/6496641.jpg!s4,86.11
503,504,西红柿土豆排骨汤,西餐,本来想做番茄排骨汤的，另一个菜是土豆泥感觉土豆多了，于是就把一部分土豆块煮进来了。成品不错，浓浓香香的。美中不足是家里没有香葱和香菜。不然感觉很像西餐馆的番茄浓汤呢~五一宅在家里没食欲，酸汤恰好开胃~,http://img.xiaochushuo.com/web/223289526.jpg!s4,104.85
504,505,芝士焗饭【自制】,西餐,自己热爱美食，西餐也不例外，而且这个焗饭可以很好的处理剩饭，味道也很赞呢！,http://img.xiaochushuo.com/web/223371387.jpg!s4,117.62
505,506,意式芝士大虾,西餐,在很多西餐里面，芝士、土豆、大虾可以说是经常看见的食材，本次做法就是很好的利用以上几个基础材料的鲜味特性，做了完美的融合！味道超级赞。本菜品绝对是具备了高颜值和美味的产品！好东西一起分享！！！！,http://img.xiaochushuo.com/web/244395470.jpg!s4,57.40
506,507,营养美容早餐 金枪鱼三明治,西餐,想要一天都精神百倍吗 味道媲美豪华西餐厅！,http://img.xiaochushuo.com/web/797491.jpg!s4,64.45
507,508,挪威三文鱼,西餐,出得场面的简易西餐,http://img.xiaochushuo.com/web/2242555.jpg!s4,32.24
508,509,草莓松饼,西餐,阳光明媚的午后与它邂逅,http://img.xiaochushuo.com/web/248240950.jpg!s4,88.81
509,510,清新芦笋,西餐,可作西餐前菜，口感清爽开胃,http://img.xiaochushuo.com/web/2243985.jpg!s4,53.35
510,511,芝士意粉,西餐,西餐必尝美食,http://img.xiaochushuo.com/web/1879483.jpg!s4,113.00
511,512,迷迭香烤时蔬,西餐,"宴客必备！而且量比较大！还有面子～
而且适合现在吃 夏天了总不能囤肉吧！也算西餐啦～
我用的烤盘是三能的正方形烤盘",http://img.xiaochushuo.com/web/223326401.jpg!s4,41.09
512,513,黑椒战斧意粉,西餐,体验做一把西餐，感觉荤素搭配还是挺健康的。,http://img.xiaochushuo.com/web/223242968.jpg!s4,116.61
513,514,芝麻豌豆鳕鱼浓汤,西餐,"  喜欢西餐，不仅仅是喜欢西餐厅的调调，更多是因为口味。西餐中的肉类我做过几种，海鲜还真是很少涉足，这主要是因为我乃肉食系动物。红肉白肉才是我的常客，海鲜实在是吃的不多，白白浪费了我生长在沿海城市着得天独厚的资源。那又如何呢？谁规定的海边生长的人就一定得爱吃海鲜？
 
    赶得巧，这两天不知道是不是吃肉吃腻了想换口味，就想吃点海货。冰箱里刚好有鳕鱼，拿出来整整吧",http://img.xiaochushuo.com/web/228949147.jpg!s4,100.95
514,515,法国家常菜：红酒烩鸡,西餐,"偏爱西餐的我最近又开始蠢蠢欲动了，天气炎热搞的人没有食欲，再加上早已吃腻了平日里的菜肴总想换换口味找点刺激。找什么刺激？有人说旅游就是从自己呆腻的地方去别人呆腻的地方，其实吃饭也是如此，中餐吃够了咱就换外国人吃够的菜吃吃！让味蕾来个时空旅行，哈哈~~
 
    考虑到是法式大餐，在制作主菜的时候还考虑到了配菜的搭配。而西餐大都以肉类为主，配菜定要做到营养平衡才可以。所以呢，这道料理的原材料稍微多一点，不过喜欢吃就别怕麻烦不是吗？",http://img.xiaochushuo.com/web/232793545.jpg!s4,51.51
515,516,芸氏通心粉,西餐,简单方便，还可做西餐高档招待，易学易懂,http://img.xiaochushuo.com/web/3278771.jpg!s4,117.29
516,517,杂菜意大利粉,西餐,"早上起來, 突然想起, 還有一些意粉, 就在雪柜里找出一些余料, 想著試做個雜菜意大利粉, 可能平時在外面吃的多了, 也就有點頭緒, 沒想到做出來的口味, 可以同大酒店的西餐廳比美, 也就順手把它寫成菜譜, 同大家分享. 這里, 我用的是昨天炒菜剩下的肉絲, 己爆好的. 在西餐廳多用爆牛肉絲或其它, 很少用猪肉的. 但吃起來, 雖沒有牛肉的香味, 也很鮮美.",http://img.xiaochushuo.com/web/14128148.jpg!s4,50.56
517,518,乌克兰：奶酪焗鲜蘑,西餐,  我这人偏好西餐的口味，所以相比之下我对怎么做西餐更好奇，也更喜欢。今天给各位介绍的这一款相信在西餐厅一定会价格不菲，咱们要的却是最大限度的经济实惠，这咋办？在家做！我相信各位一定会喜欢的，细节如下：,http://img.xiaochushuo.com/web/228385533.jpg!s4,44.85
518,519,奶香三丁,西餐,让中餐里有西餐的味道,http://img.xiaochushuo.com/web/4425692.jpg!s4,107.95
519,520,香辣烤肋排,西餐,烤的做法借鉴的是街边羊肉串和西餐里腌制肉类的传统方式，即给肉去了腥又能有一些蔬菜的清香来中和肉的油腻感。至于辣椒面是粗是细还有和孜然用多少全看个人喜好了。,http://img.xiaochushuo.com/web/13689591.jpg!s4,60.38
520,521,意式芝士香菇,西餐,意式芝士香菇是一款不错的西餐开胃小菜。个头虽小但是内容很丰富哦！大家不妨可以试一下哦！！！绝对超赞！！！,http://img.xiaochushuo.com/web/244445396.jpg!s4,44.98
521,522,芝士肉酱通心粉,西餐,看似复杂，其实只要家里准备好香料半小时就能完成这道菜！里面很多材料西餐都很常用，所以不怕囤货哦！芝士肉酱通心粉,http://img.xiaochushuo.com/web/4982732.jpg!s4,51.13
522,523,啤酒漿炸海鮮,西餐,爽口的西餐,http://img.xiaochushuo.com/web/835256.jpg!s4,66.57
523,524,番茄丝瓜补钙粥,孕婴,"小时候特别讨厌吃丝瓜，煮在面里，那味道都受不了，为此，挨了不少外公的筷子头……长大了，慢慢学会吃各种小时候讨厌吃的菜，发现那些菜换个做法，甚至换个切法，口感都不一样，渐渐喜欢上吃很多小时候讨厌的菜。

番茄丝瓜补钙粥，有丝瓜的鲜，加上番茄的一点酸，口味清淡，超级适合不喜欢吃蔬菜的baby呀~忍不住多吃了几碗的！下面我们开始做吧~",http://img.xiaochushuo.com/web/263541600.jpg!s4,59.53
524,525,海带冬瓜汤,孕婴,虾干海带冬瓜汤是一道美味的菜肴，冬瓜是一种常见的蔬菜，海带是我们平时常见的一种海产品，冬瓜和海带加上虾干做汤有很好的调理的功效，适当的喝一些不但有减肥的作用，还有利尿利水的效果，也称为补钙佳品。,http://img.xiaochushuo.com/web/264095590.jpg!s4,62.83
525,526,番茄虾仁鸡蛋水晶蒸饺,孕婴,番茄营养丰富又酸甜可口，搭配上益智又补钙的鸡蛋虾仁，做出来的蒸饺，晶莹剔透好漂亮，连挑食的宝宝都特别喜欢，补充了维生素，而且营养翻倍不打折哟……,http://img.xiaochushuo.com/web/263678240.jpg!s4,62.48
526,527,西兰花玉米鸡肉糕,孕婴,西兰花营养丰富，含大量钙、铁、钾、锰、锌等矿物质，能为宝宝补充多种维生素，尤其是维生素C，而玉米中含有丰富的钙、镁、硒等矿物质，以及维生素E和亚油酸等营养素，能够促进宝宝的视觉发育，提高身体抵抗力！这道西兰花玉米鸡肉糕参考月龄11个月以上！,http://img.xiaochushuo.com/web/263557654.jpg!s4,52.63
527,528,三色芝心饭团,孕婴,"#小小辅食日记#这个饭团可以给孩子当手指食物，自己拿着吃很方便。里面还加了芝士，让饭团更美味。颜色也非常漂亮，让孩子不知不觉把蔬菜都吃下去。
美貌与美味并存，而且做法也很简单，赶紧做起来吧！
材料：芝士1片 西蓝花一小朵 胡萝卜一段 鸡蛋一个 米饭一小碗
",http://img.xiaochushuo.com/web/260647527.jpg!s4,116.98
528,529,干炸蔬菜豆腐丸,孕婴,最近迷恋各种丸子，这个菜灵感来自于荷包豆腐，因为变异了所以还叫豆腐丸子吧。此菜用料简单，味道鲜美，操作也很简单，用来做宴客菜也是很有面子的。,http://img.xiaochushuo.com/web/258023080.jpg!s4,63.37
529,530,果仁红糖发面饼,孕婴,"从小就喜欢吃用红糖做的面食，记得以前妈妈经常给我做红糖饼或是红糖三角馒头，感觉是世界上最好吃的美味，春天适宜养肝，适当吃一点甜的是有好处的，女人要想肤色好，平常就要多吃点红糖，红糖中含有的叶酸、微量物质等可加速血液循环、增加血容量的成分，刺激机体的造血功能，扩充血容量，提高局部皮肤的营养、氧气、水分补充哟……
红糖中含有一些天然的酸类物质可以调节色素在人体的堆积，所以可以预防面部出现色斑，它可以有效调节各种色素代谢过程，平衡皮肤内色素分泌数量和色素分布情况，从而达到美容养颜的效果……",http://img.xiaochushuo.com/web/262957099.jpg!s4,109.67
