,id,foodname,foodtype,recommend,imgurl,price
1210,1211,薏米干贝冬瓜煲,减肥,"冬瓜是一款赫赫有名的减肥蔬菜。它的功效在于“利水消炎”，还具有清热解毒、除烦止渴、祛湿解暑的作用。
传统医学认为薏米有清热利暑、宜肺排脓、健脾胃、强筋骨的作用。
干贝是一款高蛋白、高矿物质的食物，配合健脾利湿的薏米、清热利水的冬瓜，既利了水，又补充了营养。
三者结合在一起，制作的这款烩菜功效显著，汤鲜菜美，是我喜欢的菜式。
喜欢吃肉的朋友可以加入肉末，味道会更香。因为先生不在家，我不吃肉，所以没有加入肉末，这样汤更突显了干贝的鲜香，我更喜欢这种味道。",http://img.xiaochushuo.com/web/50487517.jpg!s4,48.44
1211,1212,黄瓜腐竹大拌菜,减肥,女儿回来这十几天，荤腥吃的有点多，女儿回三亚工作了，我的清肠减肥继续开始了，今天开始吃素，这款大拌菜香辣爽口。,http://img.xiaochushuo.com/web/263222699.jpg!s4,112.78
1212,1213,鱼香杏鲍菇,减肥,"我所以为的好吃，不过是：
即便是简单炒炒的素菜，也可下米饭无数。
光盘后不是让你念念不忘，而是让你记住了这个味道！
PS：吃饭时，某人边吃边念叨：“你把素菜也做的这么好吃，还让不让人减肥了？！再添一碗米饭！”",http://img.xiaochushuo.com/web/262865699.jpg!s4,59.07
1213,1214,养生美颜甜品——玫瑰南瓜银耳露,减肥,"
银耳富有天然特性胶质，加上它的滋阴作用，长期服用可以润肤，并有祛除脸部黄褐斑、雀斑的功效。含膳食纤维的减肥食品，它的膳食纤维可助胃肠蠕动，减少脂肪吸收！
南瓜补中益气，清热解毒，润肠通便的作用！
玫瑰花性温，活血，疏肝解郁，美颜护肤等功效。
因此将三者组合一起，这款甜品具有补中益气，清热解毒，润肠通便，既养生保健又美容护肤，值得推荐给爱美的你……",http://img.xiaochushuo.com/web/256269009.jpg!s4,72.78
1214,1215,冬瓜花蛤汤,减肥,冬瓜性寒、味甘，具有清肺热化痰、清胃热除烦止渴、利尿解暑、除水肿降血压之功效。而且冬瓜热量很低，十分利于降脂减肥。今天分享一道味道鲜美的冬瓜花蛤汤，清爽解暑，做法巨简单，喜欢的收藏做一个哦～,http://img.xiaochushuo.com/web/263747277.jpg!s4,86.66
1215,1216,葱油拌面 简单最好味,减肥, 小时候最爱吃的就是我妈做的热汤挂面，她习惯先用油把葱花爆香后马上加酱油加水，那从窗户飘出去的葱香味，啧啧啧....香出两公里，后来偶尔看到一个网友晒葱油拌面，图片实在是平淡无奇，就是一碗面上面几个炸过了的小葱，他居然说吃了有惊艳的赶脚，我擦，写到这，想起那炸过的葱香和酱油结合出来特有的香气，我真想去煮一碗面吃，啊啊啊，减肥减肥....忍忍忍......,http://img.xiaochushuo.com/web/257115391.jpg!s4,105.40
1216,1217,拍黄瓜,减肥,减肥时吃黄瓜是大多数人的选择，但是天天都直接吃黄瓜太单一了，今天变个花样吃，来一盘拍黄瓜吧！,http://img.xiaochushuo.com/web/263072700.jpg!s4,38.41
1217,1218,甜美的下午茶之蓝莓土豆球,减肥,"土豆的蛋白质比大豆还好，最接近动物蛋白。土豆所含的钾可预防脑血管破裂。它所含的蛋白质和维生素C，均为苹果的10倍，营养价值相当于苹果的3.5倍。土豆利于减肥、防中风，还能和胃健脾，对胃溃疡、习惯性便秘、热咳及皮肤湿疹也有治疗功效。
土豆可以做出很多的美食，但是最健康营养的做法就是无油吃法。奶香四溢的蓝莓土豆球就是无油无糖、非常健康的吃法，特别适合作餐桌上的小甜品或者下午茶。",http://img.xiaochushuo.com/web/256453874.jpg!s4,45.01
1218,1219,南瓜土豆浓汤,减肥,南瓜性温味甘热量低，所含的南瓜多糖能提高机体免疫功能，富含的果胶又可以保护胃黏、减少胆固醇的吸收，有降血糖和减肥的功效，不愧是“蔬菜之王”。与富含淀粉和多种维生素的土豆搭配在一起，即可饱腹又对身体健康有益。在经历过大吃大喝的春节后，处在各种病菌滋生的春季，这道浓汤真的是非常适合大家食用的一道美味。,http://img.xiaochushuo.com/web/260234813.jpg!s4,63.47
1219,1220,酸甜鸡丁,减肥,鸡胸肉质地细腻，嫩滑，做法简单多变，所以即使是减肥的人也可以毫无负担的享用它，不但如此，鸡胸肉还含有磷脂类，磷脂类可是人体生长发育的重要来源之一，鸡胸肉还能强筋骨，调月经，止白带等作用。,http://img.xiaochushuo.com/web/260639935.jpg!s4,110.80
1220,1221,香芹黄豆芽,减肥,香芹炒黄豆芽，非常清淡爽口的一道小菜。黄豆芽和芹菜本身就有清肠、减肥的作用，两样一起炒减肥效果更好、味道更丰富。,http://img.xiaochushuo.com/web/263155627.jpg!s4,45.04
1221,1222,黎麦饭团,减肥,藜麦营养价值非常高，含有丰富的优质蛋白质和多种氨基酸和微量元素，属于易熟易消化食品，口感独特，有淡淡的坚果清香或者人参香，具有均衡补充营养、增强机体功能、修复体质、调节免疫和内分泌、提高机体应激能力，很适合婴幼儿、孕产妇、儿童、学生、老年人等特殊体质和生活不规律人群。,http://img.xiaochushuo.com/web/258457948.jpg!s4,60.70
1222,1223,农夫面包,减肥,"吃了一段时候间的黄油甜味面包，今天改良做了咸味的农夫面包，口感很惊人，两个面包一次解决掉。
我想：它就是我以后的主食了。
减肥或者素食主义者可以放心食用。",http://img.xiaochushuo.com/web/250904104.jpg!s4,42.20
1223,1224,排毒芹菜汁,减肥,解油腻，排毒养颜、美容减肥,http://img.xiaochushuo.com/web/262918936.jpg!s4,108.38
1224,1225,芹菜香干,减肥,芹菜可是个好东西哦，纤维素含量很高，减肥的佳品。而且口感脆脆的，而且，这道菜确实很简单，很容易上手的家常菜。,http://img.xiaochushuo.com/web/257948236.jpg!s4,88.12
1225,1226,凉拌秋葵,减肥,今天给大家分享一道凉拌秋葵，它的营养非常丰富，富含蛋白质、钙、铁、磷等，它的嫩荚还含有丰富的果胶、膳食纤维，其果胶的粘稠状态是植物界非常少见的，膳食纤维的占比及其中可溶性膳食纤维占比均是植物中非常高的， 所以秋葵具有非常好的清肠吸油和减肥的神奇作用，爱美的女人都喜欢吃它，又有营养还能减肥。它是一种高蛋白，高营养，低脂肪，低热量，无胆固醇的减肥佳品，适合所有减肥人群食用。,http://img.xiaochushuo.com/web/263075533.jpg!s4,36.78
1226,1227,越南春卷,减肥,越南春卷，与中国春卷最大的不同在于饼皮并不用薄面皮而是用稻米磨浆制成的米皮包裹，馅料以虾肉、猪肉和当地蔬菜为主，是越南相当盛行的一道料理。由于本人在减肥，今天我们就来一道低脂  高蛋白的越南春卷，清爽健康  无负担！！！,http://img.xiaochushuo.com/web/254227767.jpg!s4,107.44
1227,1228,蜂蜜荔枝西柚汁,减肥,西柚包含丰富的天然叶酸，对孕妈可以起到预防贫血症的功效，而且它的热量非常低，深受减肥人士的喜爱，它丰富的维生素P和维他命C可以增强皮肤及毛孔的功能，还能预防黑斑，雀斑，消除皱纹，非常有利于皮肤保健和美容。但是，西柚味道微苦，不是每个人都喜欢，那么我们怎么样才能完美的享用西柚呢？今天就来教宝宝们如何制作一款既美味又营养丰富的蜂蜜荔枝西柚汁，下面我们就一起学做起来吧~,http://img.xiaochushuo.com/web/263462641.jpg!s4,41.62
1228,1229,虾仁什蔬炒面,减肥,上学时候在食堂经常吃的一道炒面，我超爱吃。毕业之后自己研究着做，放了很多自己喜欢吃的食材，味道更好吃。说好的减肥呢，哎…又放飞自我了……,http://img.xiaochushuo.com/web/249206445.jpg!s4,46.37
1229,1230,夏日消暑，芒果西米露,减肥,"夏日炎炎胃口不开，做一道芒果西米露。
芒果气味芬芳，消食开胃降压，还能瘦身去脂，西米口感Q弹，富含膳食纤维，这一道夏季芒果甜品营养丰富，又不过度寒凉，做为早餐、或是下午茶、瘦身晚餐都很好
",http://img.xiaochushuo.com/web/260598807.jpg!s4,93.25
1230,1231,蚝油虾皮炒冬瓜,减肥,冬瓜含有较多的蛋白质、糖类及少量的钙、磷、铁等矿物质和维生素C、维生素B9、瓜氨酸、钙等营养素。冬瓜是瓜菜中唯一不含脂肪的瓜菜，并富含丙醇二酸成分，能抑制糖类物质转化为脂肪成分，又因有较强的利尿作用，可增加减肥效果。,http://img.xiaochushuo.com/web/263466045.jpg!s4,113.56
1231,1232,芦笋花炒小河虾,减肥,"芦笋营养价值丰富，享有“蔬菜之王”的美称！能防癌、抗癌、降脂减肥等功效。其味道鲜美，软嫩可口，经常食用还能清肺利水、滋阴润燥、化痰止咳、消暑解渴、润肺润肠。
芦笋花相比普通芦笋要细，都是嫩芽，买菜的时候正好遇见，就买了些回来，与小河虾一起炒，真的是超级鲜美。",http://img.xiaochushuo.com/web/257657161.jpg!s4,83.52
1232,1233,十味 双椒爆双耳,减肥,"木耳补气养血,润肺止咳,止血,降压,抗癌，另外吃木耳还能够增强身体免疫力，能够疏通血管，抗雾霾等。
银耳是富含膳食纤维的减肥食品,它的膳食纤维可助胃肠蠕动,减少脂肪吸收。",http://img.xiaochushuo.com/web/262265374.jpg!s4,82.08
1233,1234,水果糙米粥,减肥,"粥是生活中不可缺少的一部分，而糙米是非常有营养的，糙米能提高人体免疫功能，促进血液循环，还能帮助人们消除沮丧烦躁的情绪。
糙米还有减肥的好效果哦~多吃一点也不用担心哈哈！！！
糖尿病患者也非常适宜食用糙米，因为糙米中的碳水化合物被粗纤维组织包裹，人体消化吸收速度较慢，因而能很好地控制血糖。",http://img.xiaochushuo.com/web/257750985.jpg!s4,36.43
1234,1235,健康美味の鸡胸肉果蔬沙拉,减肥,这道沙拉最适合减肥的女生们，既能饱腹又增加了营养还不长肉肉，做早餐是最好不过的啦❀.(*´▽`*)❀.,http://img.xiaochushuo.com/web/263075331.jpg!s4,55.73
1235,1236,椒盐秋葵,减肥,众所周知，秋葵的营养价值很高，含有蛋白质、脂肪、碳水化合物及丰富的维他命A和B群、钙、磷、铁等，以及含有锌和硒等微量元素，对增强人体免疫力有一定帮助。常吃秋葵能保护肠胃、补肾、降糖、保护肝脏、补钙、减肥、美容美颜等功效。,http://img.xiaochushuo.com/web/261597599.jpg!s4,80.86
1236,1237,绿豆百合银耳羹,减肥,夏天到了，天气越来越热，人也变得心神恍惚心情烦躁，从超市买回来新鲜的银耳，今天就来做一个绿豆百合银耳羹去去火，还能美容养颜，瘦身减肥呢！,http://img.xiaochushuo.com/web/263446574.jpg!s4,116.79
1237,1238,健康饮品之黄瓜雪梨汁,减肥,不但颜色好看，口感也不错，混合梨汁的黄瓜汁，特别清爽，还低卡了 减肥的友友们注意咯,http://img.xiaochushuo.com/web/257341391.jpg!s4,46.98
1238,1239,豌豆凉粉,减肥,豌豆粉和其它的蔬菜不同，豌豆粉中含有其它蔬菜所没有的枝杈酸，赤霉素和植物凝素等物质，有良好的抗菌消炎，增强新陈代谢功能，通肠利便，减肥瘦身，保护视力，美容养颜。,http://img.xiaochushuo.com/web/263363248.jpg!s4,51.73
1239,1240,藜麦酸奶沙拉,减肥,"减肥健身吃什么？首先考虑的当然是蔬菜沙拉！沙拉酱油份多，我是不吃的！
今天分享一个酸奶沙拉，酸甜可口，味道很不错！
话说藜麦怎么那么好吃啊？高蛋白又营养丰富，口感很好，很受健身爱好者欢迎哦！",http://img.xiaochushuo.com/web/263344450.jpg!s4,89.27
1240,1241,暖胃滋补养生粥+海参小米粥,减肥,“ 冬季是进补的黄金季节，冬季天气干燥，而海参具有润肺、保肝、养心、和胃、壮肾的多重功效，可让我们的身体在阴阳平衡的和谐状态下，安然度过寒冬。经常喝海参小米粥，可以提供人体所必须的18种氨基酸，提前免疫力增强体质，补气养颜，减肥降脂，越活越年轻，这是海参最基本的补养功效和作用！,http://img.xiaochushuo.com/web/262652163.jpg!s4,102.50
1241,1242,【Cathy边吃边营养】— 西蓝花炒番茄,减肥,"1、Cathy营养课堂：
西蓝花和番茄均具有较强的抗氧化功能，均属于高质量低热量的蔬菜，有减肥作用。
番茄内还含有抗癌抗衰老的物质：谷胱甘肽和番茄红素，番茄红素对前列腺癌有预防作用，对多种细菌和真菌有抑制作用。
2、Cathy菜谱优化：:
西蓝花和番茄自身的营养价值都比较高，我把它们有机的结合成这道‘西蓝花炒番茄’，可以起到补充人体维生素以及矿物质的作用。",http://img.xiaochushuo.com/web/48796214.jpg!s4,104.20
1242,1243,盐面包,减肥,很好吃的一款面包，值得试试,http://img.xiaochushuo.com/web/263288595.jpg!s4,117.80
1243,1244,别恨自己的胃太小，这样做酱油炒饭让您一次爱个够 ,减肥,炒饭是最简单的，也是为了解决剩饭，炒饭可以无师自通，随心所欲的添加各种自己喜欢的材料，变着花样。从而衍生出多样口味，酱油炒饭就是一道家常主食，在曾经物资匮乏的年代，酱油炒饭的那份留在唇齿间的醇香，可是很多孩子童年不可抹去的记忆......我不是人民币，做不到每个人都喜欢呀，不过可以试一试，今天这道炒饭可是加了老卤汁，比单纯的加入酱油可香多了。卤水酱油炒饭味道好极了！可以让人多吃两碗的节奏哦！减肥的小伙伴们需要克制哦！味道超棒、操作简单的黑暗料理卤水酱油炒饭可是懒人的福音哦！,http://img.xiaochushuo.com/web/226824375.jpg!s4,96.80
1244,1245,香蕉牛奶烤燕麦,减肥,今天分享一道超简单的香蕉牛奶烤燕麦，由香蕉、水果燕麦片、牛奶、鸡蛋四样食材搭配在一起制作而成，非常不错的低脂营养早餐，减肥必备，喜欢的收藏起来有空试试吧。,http://img.xiaochushuo.com/web/263748146.jpg!s4,60.18
1245,1246,黄瓜酿肉,减肥,夏季最适合吃黄瓜，黄瓜经常食用，可以减肥利水清热，平常除了凉拌，也可以像今天这样与瘦肉搭配蒸出营养美味的黄瓜酿肉！,http://img.xiaochushuo.com/web/261375498.jpg!s4,72.70
1246,1247,杨枝甘露,减肥,"
夏秋之季芒果西柚上市，做一道份量足足的杨枝甘露，诱人的芒果香气打开味蕾，西柚的酸甜清爽扫去疲倦，Q弹的西米提供能量，每一口都有着奶油鲜奶椰浆的细滑如丝，烈日炎炎里带来好心情。
配方不加糖和奶油的话，这样低脂低卡高钾的食材的搭配，还能作为降脂血压塑身美颜餐呢。
",http://img.xiaochushuo.com/web/260149184.jpg!s4,60.93
1247,1248,了不起的小番茄+什锦减脂沙拉,减肥,春天不减肥，夏天肉堆堆。想吃又怕胖，这时候就少不了这美味又爽口、又营养的凉拌菜了。做法方便、简单、又好吃、不怕胖的凉拌菜来了。,http://img.xiaochushuo.com/web/260446230.jpg!s4,35.99
1248,1249,冬瓜虾肉汆丸子汤,减肥,冬瓜清热解毒，护肾利尿，降脂减肥，，虾增强免疫力，防癌抗癌，延缓衰老，天气转热多吃冬瓜好处多多，清爽鲜香的冬瓜汆虾肉丸子好赞哦,http://img.xiaochushuo.com/web/260101550.jpg!s4,32.15
1249,1250,包菜煎饼,减肥,很喜欢吃包菜～热量低价格实惠很容易有饱腹感，绝对是减肥者的最爱！好吃的东西其实也不一定非要用什么高大上的材料，煎饼的造型也不一定要多复杂，就像这款用普通的包菜做的煎饼，造型简单却独特~包菜并不昂贵做出的煎饼却也味美。,http://img.xiaochushuo.com/web/48791703.jpg!s4,55.90
1250,1251,瘦身红豆薏米冬瓜汤,减肥,这是一款祛湿神器，在雨水过多的季节，或者体内湿气较重的朋友，这款汤可以将体内的湿气迅速排出，再也不怕水肿所带来的臃肿体型，想减肥的朋友们赶快试起来哦。,http://img.xiaochushuo.com/web/261053831.jpg!s4,58.02
1251,1252,鸡茸玉米粥,减肥,"平时上班比较忙，下班回家大多以熬白粥居多，白粥吃多了自然寡淡，时不时的也会换换口味来个咸粥吃。劳累了一天回到家捧上这么一碗热气腾腾的鸡茸玉米粥，暖心、暖胃又营养。
囡姐今天安利给大家的这道鸡茸玉米粥较为清淡热量较低，营养搭配合理全面，在减肥期间食用也会带来明显的减脂效果。",http://img.xiaochushuo.com/web/262528295.jpg!s4,117.99
1252,1253,香菇小酱炸酱面,减肥,老公最爱吃各种面、特别是用香菇做的炸酱面、今天刚好买了香菇酱、立马给老公做了炸酱面、老公连吃了两碗、关于减肥的问题、估计早就抛到九霄云外了、哈哈……,http://img.xiaochushuo.com/web/259301692.jpg!s4,76.78
1253,1254,蒜蓉芝麻酱淋生菜,减肥,生菜，是汉堡中不可缺少的夹菜，也是很多菜品必不可少的点缀，生菜的含水量很高，营养也非常丰富，而且超级低脂，绝对是减肥者的最爱~这道菜十分钟就可以做好，简单方便。吃起来清脆开胃，是非常清爽的一道菜。喜欢的亲们一定要试试看，很贴心的哦~,http://img.xiaochushuo.com/web/262920187.jpg!s4,104.66
1254,1255,日式土豆沙拉,减肥,减肥人员的必备神器,http://img.xiaochushuo.com/web/263096944.jpg!s4,80.40
1255,1256,便当常备菜系列：豆腐鸡肉丸子,减肥,减肥期间每天自己带便当，不想天天吃水煮菜，所以会提前准备一些放便当里的备菜，早上做便当的时候直接放饭盒里一起加热很节约时间。豆腐和鸡肉也是很适合减肥的食材，蛋白质含量高且热量做成丸子好看又好吃。,http://img.xiaochushuo.com/web/257123479.jpg!s4,30.01
1256,1257,杂粮粥,减肥,今天跟大家分享的这道养生粥，是一款好喝的杂粮养生粥。杂粮粥当然以杂粮为主料，搭配上各种谷物：黑豆、黑米、红枣、花生等等，也可以搭配自己喜欢的。尤其是黑色谷物，都有补肾、乌发，养颜补血的功效。是“减肥养生者”的不二选择。,http://img.xiaochushuo.com/web/262844070.jpg!s4,103.82
1257,1258,一次性发酵葡萄干椰子油白吐司,减肥,"葡萄干比阿斯匹林能更好地阻止血栓形成，降低人体血清胆固醇水平，对预防心脑血管病有一定作用。葡萄干是吃了不容易发胖的干果，女性每天食用十来颗含有大量维生素的葡萄干，既能达到减肥目的，又有益于心血管健康。葡萄干为营养食品，适合虚弱体质者食用。葡萄干的抗癌作用尤其明显，同时可抗衰老。
椰子油、多奶制品的加入，同时采取低糖健康的理念，使得这款吐司椰子味醇香浓郁，口味淡雅，吃到葡萄干时又香甜可口。
方子是两个450g吐司量，如果做一个可以减半。",http://img.xiaochushuo.com/web/256193728.jpg!s4,80.99
1258,1259,香蕉烤燕麦,减肥,无油无糖低脂，饱腹感强，减肥消脂的食谱。,http://img.xiaochushuo.com/web/263261403.jpg!s4,106.24
1259,1260,吃出好身材，三文鱼沙拉晚餐,减肥,"春日瘦身好时机
瘦身只吃蔬菜水果？
吃出易胖陷入反复减肥怪圈
营养师教您科学瘦身
控制摄入总能量
祛湿健脾调体质
日常三餐里
吃出美丽苗条与健康

这一道滋味丰富的三文鱼沙拉晚餐
有三文鱼的甜香
虾仁的鲜美
黄瓜生菜番茄的清甜
果仁的酥脆
牛油果的软糯
淋上一勺低卡油醋汁
更添酸辣可口

十一种食材的瘦身晚餐
香蕉去湿排毒
红豆薏米藜麦去湿健脾通肠道
三文鱼提供优质蛋白质
含有丰富的亚麻酸和维生素E疏通血管
黄瓜消脂排毒
核桃健脾益气
",http://img.xiaochushuo.com/web/260118086.jpg!s4,101.30
1260,1261,香葱苏打饼干,减肥,最近减肥的朋友们都迷上了苏打饼干，低糖少油的苏打饼干鲜香美味，葱香的味道，脆脆的口感，没有人能抵挡的住的小零食。,http://img.xiaochushuo.com/web/263198578.jpg!s4,108.86
1261,1262,椰香南瓜派,减肥,"俗话说""药补不如食补""。南瓜味甘，性温，归脾，胃经，具有补中益气、清热解毒的功效，南瓜的营养成分较全，营养价值也较高。南瓜含有丰富的糖类和淀粉，有较丰富的维生素，吃起来又香又甜;其蛋白质和脂肪含量较低。常吃南瓜，肌肤丰美，尤其对女性，有美容和减肥的作用。今年婆婆家南瓜大丰收，堆满了一屋子，做菜吃多了也觉得腻，偶尔会用来做一些烘焙的小甜点。临近感恩节，就来个南瓜派吧。此配方做9.5寸派盘正好合适",http://img.xiaochushuo.com/web/46965846.jpg!s4,108.36
1262,1263,冬日暖心菜  鸡肉黄瓜胡萝卜包,减肥,老公最近减肥，不吃油腻的食物，今天给他做了鸡肉黄瓜胡萝卜包，低脂营养又不长肉肉，出锅后老公立马干掉了一屉哟，说好好吃哦……,http://img.xiaochushuo.com/web/263952928.jpg!s4,97.03
1263,1264,红豆薏米甜酒酿,减肥,"红豆薏米高纤维低脂肪，是公认的排毒减肥圣品，不仅能够将脾祛湿，增强肾功能，常食用还能使皮肤光滑，对粉刺和保护头发也有一定的作用。嘴馋的我还加了几勺甜酒酿，它能够促进血液循环，助消化及增进食欲，口感也相当赞！
美的BB煲精煮细熬，口感非常棒，奶瓶级的玻璃内胆，安全耐高温，饭勺汤勺抗菌率高达99%，除了能炖、煮和制作酸奶，还有消毒功能，日常还可以给宝宝消毒碗筷和奶瓶，很贴心的设计！",http://img.xiaochushuo.com/web/263500860.jpg!s4,115.37
1264,1265,营养早餐豆芽饼,减肥,很少人知道豆芽还有很高的药用价值，可以帮助减肥。豆芽性凉味甘，不仅能清暑热、通经脉、解诸毒，还能调五脏、美肌肤、利湿热。一把面粉少许豆芽做出的“豆芽饼”，炸至金黄外酥里嫩，早餐要不要来一份，真的是好吃极了！,http://img.xiaochushuo.com/web/261433136.jpg!s4,104.79
1265,1266,咖喱鸡饭,减肥,"咖喱的健康功效
咖喱内含较多粗纤维和蛋白质、多种维生素等，并含有钙、铁、磷、镁、钾等多种微量元素，具有温身、健脾、暖胃、提高肝脏机能、刺激食欲及净化血液、减肥、降低血糖、解消便秘、补充精力等功效。是非常健康的料理之一。将具有药效的香辛料组合在一起，再放入蔬菜、豆类及肉、鱼等一起煮，就成为营养均衡的一道美食。咖喱的辣味促进发汗，加快血液循环，还有提高新成代谢功能的作用。",http://img.xiaochushuo.com/web/261228298.jpg!s4,59.99
1266,1267,夏天最滋润的事，就是来一杯酸甜柠檬蜜,减肥,"      柠檬富含各种维他命，柠檬皮则藏有大量的钙质，常食用，可祛斑、美白肌肤，同时抵抗电脑辐射。蜂蜜清热、润燥、解毒。炎热的夏天里，自己动手制作一罐柠檬蜜，每日清晨起床空腹喝上一杯，温饮，或加入冰块、菊花等做一款冰饮都很好，酸酸甜甜，解渴开胃助消化，还可以排毒养颜，补充肌肤营养，延缓衰老，加速排便，有减肥功效。

",http://img.xiaochushuo.com/web/260829781.jpg!s4,43.42
1267,1268,千张结烧肉,减肥,"千张跟肉可谓是绝配，老妈的拿手菜是千张结烧五花肉，简直是米饭杀手啊。千张切成三指宽粗条挽成结，五花肉切块焯水后小火慢炒，等猪油析出来了，放点香料，加点酱油胡椒翻炒，加水煮开后放入挽好的千张结，焖煮汁干。打开锅盖，简直香得要了老命啊。每一块烧肉都晶莹剔透、入口即化。千张结充分的吸收了炖肉的汤汁，香味四溢。咬一口，汤汁丰盈，绵软还有嚼劲，剩下汤汁拌面条或者米饭，一碗接一碗啊。美食在眼前，还谈什么减肥呢，吃完这顿饭再减肥吧。
",http://img.xiaochushuo.com/web/257847277.jpg!s4,79.63
1268,1269,手撕杏鲍菇,减肥,杏鲍菇是可以和肉媲美的素菜，减肥又解馋的手撕杏鲍菇做法，来看看！,http://img.xiaochushuo.com/web/260433869.jpg!s4,58.41
1269,1270,鸡肉香菇黑胡椒意面,减肥,特别爱吃意面，因为意面不但不会发胖，还能帮助减肥瘦身。口感也特别劲道。今天教大家做鸡肉香菇黑胡椒意面。,http://img.xiaochushuo.com/web/261098989.jpg!s4,97.94
1270,1271,糖醋菜+糖醋鸡胸肉,减肥,糖醋不只有排骨，猪里脊，还有减肥瘦身的神器-鸡胸肉！这款糖醋鸡胸肉是绝对的低脂最爱～又健康又满足口腹之欲～最重要的是，太简单了！,http://img.xiaochushuo.com/web/257705387.jpg!s4,89.38
